{
  "$schema": "http://json-schema.org/draft-07/schema#",
  "$id": "config.schema.json",
  "title": "NoCloud CFX Config",
  "description": "Configuration schema for no-cloud-cfx",
  "type": "object",
  "properties": {
    "$schema": {
      "type": "string",
      "description": "JSON Schema reference"
    },
    "client_identifier_extractor": {
      "type": "string",
      "description": "Client identifier extractor method used in rate limiting and metadata attachments. (ip, license, steam etc or combination like ip:license)",
      "default": "ip:license",
      "pattern": "^(ip|steam|discord|license|license2|fivem|xbl|live)(:(ip|steam|discord|license|license2|fivem|xbl|live))*$"
    },
    "logging": {
      "type": "object",
      "description": "Logging configuration",
      "properties": {
        "enabled": {
          "type": "boolean",
          "description": "Whether logging is enabled",
          "default": true
        },
        "level": {
          "type": "string",
          "description": "Log level",
          "enum": ["debug", "info", "warn", "error"],
          "default": "info"
        }
      },
      "required": ["enabled", "level"],
      "additionalProperties": false
    },
    "storage": {
      "type": "object",
      "description": "Storage configuration",
      "properties": {
        "metadata_attachments": {
          "type": "object",
          "description": "Metadata attachment configuration",
          "properties": {
            "masked_identifiers": {
              "type": "array",
              "description": "List of client identifiers to mask in metadata (ip is always masked, identifier will be retrieved based on client_identifier_extractor)",
              "items": {
                "type": "string",
                "enum": [
                  "ip",
                  "steam",
                  "discord",
                  "license",
                  "license2",
                  "fivem",
                  "xbl",
                  "live"
                ]
              },
              "default": ["ip"]
            },
            "resource": {
              "type": "boolean",
              "description": "Whether to attach resource name to file metadata",
              "default": true
            },
            "player": {
              "type": "boolean",
              "description": "Whether to attach player identifier to file metadata",
              "default": true
            }
          },
          "required": ["masked_identifiers", "resource", "player"],
          "additionalProperties": false
        },
        "enable_client_uploads": {
          "type": "boolean",
          "description": "Whether client uploads are enabled",
          "default": true
        },
        "max_file_size_mb": {
          "type": "number",
          "description": "Maximum upload file size in megabytes",
          "minimum": 1,
          "default": 50
        },
        "allowed_file_types": {
          "type": "array",
          "description": "List of allowed MIME types for uploads",
          "items": {
            "type": "string",
            "pattern": "^[a-z]+/[a-z0-9.+-]+$"
          },
          "default": [
            "text/plain",
            "image/jpeg",
            "image/png",
            "image/gif",
            "image/webp",
            "image/svg+xml",
            "video/mp4",
            "video/webm",
            "audio/mpeg",
            "audio/wav"
          ]
        },
        "rate_limit": {
          "type": "object",
          "description": "Rate limiting configuration",
          "properties": {
            "enabled": {
              "type": "boolean",
              "description": "Whether rate limiting is enabled",
              "default": true
            },
            "window_ms": {
              "type": "integer",
              "description": "Maximum number of uploads per minute per client",
              "minimum": 1000,
              "default": 60000
            },
            "max_requests": {
              "type": "integer",
              "description": "Maximum number of uploads per minute per client",
              "minimum": 1,
              "default": 15
            }
          },
          "required": ["enabled", "window_ms", "max_requests"],
          "additionalProperties": false
        }
      },
      "required": [
        "metadata_attachments",
        "enable_client_uploads",
        "max_file_size_mb",
        "allowed_file_types",
        "rate_limit"
      ],
      "additionalProperties": false
    },
    "flags": {
      "type": "object",
      "description": "Feature flag configuration",
      "properties": {
        "enabled": {
          "type": "boolean",
          "description": "Whether feature flags are available at all. With this off every read falls back and nothing is fetched",
          "default": true
        },
        "cache_ttl_seconds": {
          "type": "integer",
          "description": "How long a fetched configuration is served from memory before a read goes back to the API, in seconds. It bounds the polling loop too - a poll landing inside this window skips its turn",
          "minimum": 1,
          "default": 10
        },
        "global_state_key": {
          "type": "string",
          "description": "GlobalState key the shared flag values are published under, which is how clients read them. Server-only flags are never included",
          "pattern": "^[A-Za-z_][A-Za-z0-9_]*$",
          "default": "nocloud_flags"
        },
        "persist_last_known": {
          "type": "boolean",
          "description": "Whether the last received flags are kept in resource key/value storage, so they are served immediately on the next start and while the API is unreachable. The cache holds server-only values and stays on the server host",
          "default": true
        },
        "polling": {
          "type": "object",
          "description": "Background polling configuration",
          "properties": {
            "enabled": {
              "type": "boolean",
              "description": "Whether the flags are refetched whether or not a client is reading them. Off by default, in which case polling runs only while at least one client is - turn it on when something watches the GlobalState key or the nocloud.flags.updated event and must see a change nobody read",
              "default": false
            },
            "interval_ms": {
              "type": "integer",
              "description": "How often the flags are refetched while polling runs, in milliseconds. A tick landing inside cache_ttl_seconds skips, so that window is the real floor. Values below 10000 are raised to 10000",
              "minimum": 10000,
              "default": 60000
            }
          },
          "required": ["enabled", "interval_ms"],
          "additionalProperties": false
        }
      },
      "required": [
        "enabled",
        "cache_ttl_seconds",
        "global_state_key",
        "persist_last_known",
        "polling"
      ],
      "additionalProperties": false
    }
  },
  "required": ["client_identifier_extractor", "logging", "storage", "flags"],
  "additionalProperties": false
}
